{
  "schema_version": 1,
  "manifest_id": "smells-sources",
  "manifest_version": "1.1.0",
  "reviewed_on": "2026-09-27",
  "sources": [
    {
      "source_id": "fowler-beck-refactoring-1e",
      "kind": "book_edition",
      "title": "Refactoring: Improving the Design of Existing Code",
      "authors": ["Martin Fowler"],
      "contributors": ["Kent Beck (Chapter 3 coauthor)", "John Brant", "William Opdyke", "Don Roberts"],
      "publisher": "Addison-Wesley",
      "publication_year": 1999,
      "edition": "1",
      "isbn": "9780201485677",
      "canonical_url": "https://ptgmedia.pearsoncmg.com/images/9780201485677/samplepages/0201485672.pdf",
      "revision": "edition:1",
      "reviewed_on": "2026-09-27",
      "catalog_fingerprint": "sha256:c6bc1c1e3dd85b3713532ec8197f620ddccbb9312c31839ccbf0aeb6cbb412a9",
      "monitoring": "stable_identifier",
      "reuse": "cite_and_paraphrase"
    },
    {
      "source_id": "fowler-refactoring-2e",
      "kind": "book_edition",
      "title": "Refactoring: Improving the Design of Existing Code",
      "authors": ["Martin Fowler"],
      "contributors": ["Kent Beck (Chapter 3 coauthor)"],
      "publisher": "Addison-Wesley Professional",
      "publication_year": 2018,
      "edition": "2",
      "isbn": "9780134757599",
      "canonical_url": "https://www.informit.com/articles/article.aspx?p=2952392",
      "edition_url": "https://martinfowler.com/books/refactoring.html",
      "revision": "edition:2",
      "reviewed_on": "2026-09-27",
      "catalog_fingerprint": "sha256:2ab7cda47f5b51a2ad8b0432d6a1ae0dc71eedec31541540ff7502f306695b7d",
      "monitoring": "stable_identifier",
      "reuse": "cite_and_paraphrase"
    },
    {
      "source_id": "refactoring-guru-smells-web",
      "kind": "live_web_catalog",
      "title": "Code Smells",
      "authors": ["Refactoring.Guru"],
      "publisher": "Refactoring.Guru",
      "canonical_url": "https://refactoring.guru/refactoring/smells",
      "revision": "checked:2026-09-27",
      "reviewed_on": "2026-09-27",
      "catalog_fingerprint": "sha256:0737ed9607e6994948aca9a650bb4d7ad48e03299e77396f140fd63431d81cbe",
      "monitoring": "web_content",
      "reuse": "cite_and_paraphrase"
    },
    {
      "source_id": "mantyla-lassenius-2006",
      "kind": "research_paper",
      "title": "Subjective Evaluation of Software Evolvability Using Code Smells: An Empirical Study",
      "authors": ["Mika V. Mäntylä", "Casper Lassenius"],
      "publisher": "Springer",
      "publication_year": 2006,
      "doi": "10.1007/s10664-006-9002-8",
      "canonical_url": "https://link.springer.com/article/10.1007/s10664-006-9002-8",
      "full_text_url": "https://mmantyla.github.io/ESE_2006.pdf",
      "revision": "doi:10.1007/s10664-006-9002-8",
      "reviewed_on": "2026-09-27",
      "catalog_fingerprint": "sha256:687cceccc856beb8b9fa6abc9968769cb50e83015bca02183e08a76deccbcdc3",
      "monitoring": "stable_identifier",
      "reuse": "cite_and_paraphrase"
    },
    {
      "source_id": "lanza-marinescu-2006",
      "kind": "book_edition",
      "title": "Object-Oriented Metrics in Practice",
      "authors": ["Michele Lanza", "Radu Marinescu"],
      "publisher": "Springer Berlin, Heidelberg",
      "publication_year": 2006,
      "edition": "1",
      "isbn": "9783540244295",
      "doi": "10.1007/3-540-39538-5",
      "canonical_url": "https://link.springer.com/book/10.1007/3-540-39538-5",
      "revision": "doi:10.1007/3-540-39538-5",
      "reviewed_on": "2026-09-27",
      "catalog_fingerprint": "sha256:b7eeeb9a045a00ade50095a9e2a8e734575db2a27ecadf21e5f10c27cf204fa8",
      "monitoring": "stable_identifier",
      "reuse": "cite_and_paraphrase"
    },
    {
      "source_id": "decor-2010",
      "kind": "research_paper",
      "title": "DECOR: A Method for the Specification and Detection of Code and Design Smells",
      "authors": ["Naouel Moha", "Yann-Gaël Guéhéneuc", "Laurence Duchien", "Anne-Françoise Le Meur"],
      "publisher": "IEEE",
      "publication_year": 2010,
      "doi": "10.1109/TSE.2009.50",
      "canonical_url": "https://doi.org/10.1109/TSE.2009.50",
      "full_text_url": "https://inria.hal.science/inria-00538476/document",
      "revision": "doi:10.1109/TSE.2009.50",
      "reviewed_on": "2026-09-27",
      "catalog_fingerprint": "sha256:8a83d3f3a4018b134761024315d8e21626575f80d4a628a332e1989a3d4296cd",
      "monitoring": "stable_identifier",
      "reuse": "cite_and_paraphrase"
    }
  ]
}
